{
  "catalog_schema_version": "0.1",
  "catalog_id": "TMAI-OTEL-SEMANTIC-CONFORMANCE-0.1",
  "status": "ADOPTED_CONTRACT_NOT_EXECUTED",
  "primary_repository": "digital-biosphere-architecture",
  "decision_reference": "DQ-023",
  "contract_binding": {
    "otel_specification": "v1.59.0@a824fb4eba795c5c65dd397b3d22e7c28e934de3",
    "core_semconv": "v1.43.0@89aae438b3b3b0a8dd33003c9d70592baf7dbd0d",
    "genai_semconv_commit": "2e994c6d59a93bb4fc1752c5378eedb9b8e14d6b",
    "genai_schema_url": null,
    "otlp": "v1.11.0@790608c4d51e6ffc12210b541e8514cbed9e91a4",
    "semantic_profile_id": "TMAI-OTEL-SEMANTIC-CONVENTIONS-PROFILE-0.1",
    "mapping_catalog_id": "TMAI-OTEL-SEMANTIC-MAPPING-0.1",
    "mapping_catalog_path": "architecture/opentelemetry-semantic-mapping.v0.1.json",
    "mapping_catalog_digest": null,
    "mapping_catalog_status": "ADOPTED_CONTRACT_NOT_IMPLEMENTED"
  },
  "case_groups": [
    {"group_id":"SEM-CG-VERSION_SOURCE","title":"Version and source binding","purpose":"Reject unpinned, mismatched, or unverifiable upstream and mapping references.","required_for_gates":["DQ-023","DQ-018","PR-G2"],"required_case_ids":["SEM-CF-VSN-001","SEM-CF-VSN-002","SEM-CF-VSN-003","SEM-CF-VSN-004","SEM-CF-VSN-005"]},
    {"group_id":"SEM-CG-CORE_STABLE","title":"Core stable metadata","purpose":"Preserve Stable resource, instrumentation scope, trace, span, and error semantics without authority elevation.","required_for_gates":["DQ-018","PR-G2"],"required_case_ids":["SEM-CF-CORE-001","SEM-CF-CORE-002","SEM-CF-CORE-003","SEM-CF-CORE-004","SEM-CF-CORE-005"]},
    {"group_id":"SEM-CG-GENAI_METADATA","title":"Pinned GenAI metadata","purpose":"Map pinned Development Agent, workflow, model, usage, tool, and evaluation fields as non-authoritative material.","required_for_gates":["DQ-023","DQ-018","PR-G2"],"required_case_ids":["SEM-CF-GENAI-001","SEM-CF-GENAI-002","SEM-CF-GENAI-003","SEM-CF-GENAI-004","SEM-CF-GENAI-005","SEM-CF-GENAI-006"]},
    {"group_id":"SEM-CG-SENSITIVE_CONTENT","title":"Sensitive content governance","purpose":"Keep eight content fields disabled by default and require complete, exact, redacted opt-in governance.","required_for_gates":["DQ-018","PR-G5"],"required_case_ids":["SEM-CF-SENS-001","SEM-CF-SENS-002","SEM-CF-SENS-003","SEM-CF-SENS-004","SEM-CF-SENS-005","SEM-CF-SENS-006","SEM-CF-SENS-007","SEM-CF-SENS-008","SEM-CF-SENS-009","SEM-CF-SENS-010"]},
    {"group_id":"SEM-CG-DEPRECATED_DRIFT","title":"Deprecated and drift handling","purpose":"Reject deprecated fields and fail closed on unknown mapping, source, or version drift while retaining diagnostics.","required_for_gates":["DQ-023","DQ-018","PR-G2"],"required_case_ids":["SEM-CF-DRIFT-001","SEM-CF-DRIFT-002","SEM-CF-DRIFT-003","SEM-CF-DRIFT-004","SEM-CF-DRIFT-005"]},
    {"group_id":"SEM-CG-AUTHORITY_BOUNDARY","title":"Authority boundary","purpose":"Prevent telemetry identifiers, operations, tools, evaluations, and injected fields from creating canonical or authority facts.","required_for_gates":["DQ-018","PR-G2","PR-G5"],"required_case_ids":["SEM-CF-AUTH-001","SEM-CF-AUTH-002","SEM-CF-AUTH-003","SEM-CF-AUTH-004","SEM-CF-AUTH-005","SEM-CF-AUTH-006","SEM-CF-AUTH-007"]},
    {"group_id":"SEM-CG-CARDINALITY","title":"Cardinality and cost","purpose":"Enforce metric-label prohibitions, bounded dimensions, explicit overflow, and no silent drop.","required_for_gates":["DQ-020","PR-G3","PR-G5"],"required_case_ids":["SEM-CF-CARD-001","SEM-CF-CARD-002","SEM-CF-CARD-003","SEM-CF-CARD-004"]},
    {"group_id":"SEM-CG-RESULT_BOUNDARY","title":"Result and gate boundary","purpose":"Bind results to immutable contracts and prevent synthetic, incomplete, or self-authorizing PASS claims.","required_for_gates":["PR-G2","PR-G3","PR-G6"],"required_case_ids":["SEM-CF-RESULT-001","SEM-CF-RESULT-002","SEM-CF-RESULT-003","SEM-CF-RESULT-004"]}
  ],
  "cases": [
    {"case_id":"SEM-CF-VSN-001","group_id":"SEM-CG-VERSION_SOURCE","title":"Exact core source accepted","case_class":"VERSION_SOURCE","mapping_ids":["OTEL-SM-001","OTEL-SM-005","OTEL-SM-020"],"signal_surfaces":["RESOURCE","TRACE"],"fixture_class":"VALID_METADATA","stimulus":"Use exact OTel Specification v1.59.0 and core SemConv v1.43.0 bindings.","expected_outcome":"MAPPED_METADATA_ONLY","required_assertions":["Exact tag and commit retained","Field source registry resolves uniquely"],"required_evidence":["source binding report","fixture digest"],"forbidden_effects":"ALL_CANONICAL_AND_AUTHORITY_EFFECTS","gate_refs":["DQ-023","DQ-018","PR-G2"],"authorization_prerequisites":["DQ-023 and DQ-018 must be human-decided before execution"],"implementation_required":true,"current_execution_status":"NOT_EXECUTED"},
    {"case_id":"SEM-CF-VSN-002","group_id":"SEM-CG-VERSION_SOURCE","title":"Unpinned latest rejected","case_class":"VERSION_SOURCE","mapping_ids":["OTEL-SM-001"],"signal_surfaces":["ANY"],"fixture_class":"INVALID_VERSION","stimulus":"Replace an exact tag and commit with latest or main.","expected_outcome":"REJECTED_WITH_DIAGNOSTIC","required_assertions":["No automatic latest resolution","Version drift retained"],"required_evidence":["rejection code","source comparison"],"forbidden_effects":"ALL_CANONICAL_AND_AUTHORITY_EFFECTS","gate_refs":["DQ-023","DQ-018","PR-G2"],"authorization_prerequisites":["DQ-018 must authorize offline semantic conformance execution"],"implementation_required":true,"current_execution_status":"NOT_EXECUTED"},
    {"case_id":"SEM-CF-VSN-003","group_id":"SEM-CG-VERSION_SOURCE","title":"Mapping digest mismatch rejected","case_class":"VERSION_SOURCE","mapping_ids":["OTEL-SM-011"],"signal_surfaces":["ANY"],"fixture_class":"INVALID_VERSION","stimulus":"Bind a result to a mapping catalog whose digest differs from the executed catalog.","expected_outcome":"FAIL_CLOSED_NO_EFFECT","required_assertions":["Digest mismatch blocks result","Old result is not inherited"],"required_evidence":["expected and observed digests","validator finding"],"forbidden_effects":"ALL_CANONICAL_AND_AUTHORITY_EFFECTS","gate_refs":["DQ-023","DQ-018","PR-G2"],"authorization_prerequisites":["A human-adopted contract and authorized validator execution are required"],"implementation_required":true,"current_execution_status":"NOT_EXECUTED"},
    {"case_id":"SEM-CF-VSN-004","group_id":"SEM-CG-VERSION_SOURCE","title":"Unknown GenAI commit rejected","case_class":"VERSION_SOURCE","mapping_ids":["OTEL-SM-021","OTEL-SM-023","OTEL-SM-032"],"signal_surfaces":["TRACE","EVENT"],"fixture_class":"INVALID_VERSION","stimulus":"Supply GenAI fields without the pinned exact commit or with a different commit.","expected_outcome":"REJECTED_WITH_DIAGNOSTIC","required_assertions":["Development fields fail closed on commit drift","GenAI fields are not upgraded to Stable"],"required_evidence":["commit comparison","rejection limitation"],"forbidden_effects":"ALL_CANONICAL_AND_AUTHORITY_EFFECTS","gate_refs":["DQ-023","DQ-018","PR-G2"],"authorization_prerequisites":["DQ-023 and DQ-018 must be human-decided before execution"],"implementation_required":true,"current_execution_status":"NOT_EXECUTED"},
    {"case_id":"SEM-CF-VSN-005","group_id":"SEM-CG-VERSION_SOURCE","title":"Missing scope schema URL retained","case_class":"VERSION_SOURCE","mapping_ids":["OTEL-SM-013"],"signal_surfaces":["TRACE","METRIC","LOG"],"fixture_class":"MISSING_BINDING","stimulus":"Provide a valid Instrumentation Scope with no schema URL.","expected_outcome":"RETAINED_LIMITATION","required_assertions":["Schema URL remains unknown","No URL is guessed","Other independently Stable metadata may remain"],"required_evidence":["scope projection","unknown limitation"],"forbidden_effects":"ALL_CANONICAL_AND_AUTHORITY_EFFECTS","gate_refs":["DQ-023","DQ-018","PR-G2"],"authorization_prerequisites":["DQ-018 must authorize offline semantic conformance execution"],"implementation_required":true,"current_execution_status":"NOT_EXECUTED"},

    {"case_id":"SEM-CF-CORE-001","group_id":"SEM-CG-CORE_STABLE","title":"Service and deployment metadata","case_class":"POSITIVE_MAPPING","mapping_ids":["OTEL-SM-001","OTEL-SM-002","OTEL-SM-003","OTEL-SM-004","OTEL-SM-005"],"signal_surfaces":["RESOURCE"],"fixture_class":"VALID_METADATA","stimulus":"Map valid service namespace, name, instance, version, and deployment environment.","expected_outcome":"MAPPED_METADATA_ONLY","required_assertions":["All five mapping IDs matched","Service instance remains an identity hint"],"required_evidence":["input and output attribute inventory","mapping trace"],"forbidden_effects":"ALL_CANONICAL_AND_AUTHORITY_EFFECTS","gate_refs":["DQ-018","PR-G2"],"authorization_prerequisites":["DQ-018 must authorize offline semantic conformance execution"],"implementation_required":true,"current_execution_status":"NOT_EXECUTED"},
    {"case_id":"SEM-CF-CORE-002","group_id":"SEM-CG-CORE_STABLE","title":"SDK and distribution metadata","case_class":"POSITIVE_MAPPING","mapping_ids":["OTEL-SM-006","OTEL-SM-007","OTEL-SM-008","OTEL-SM-009","OTEL-SM-010"],"signal_surfaces":["RESOURCE"],"fixture_class":"VALID_METADATA","stimulus":"Map valid telemetry SDK and distribution metadata.","expected_outcome":"MAPPED_METADATA_ONLY","required_assertions":["SDK and distribution fields remain instrumentation descriptions"],"required_evidence":["input and output attribute inventory","mapping trace"],"forbidden_effects":"ALL_CANONICAL_AND_AUTHORITY_EFFECTS","gate_refs":["DQ-018","PR-G2"],"authorization_prerequisites":["DQ-018 must authorize offline semantic conformance execution"],"implementation_required":true,"current_execution_status":"NOT_EXECUTED"},